"","title","subtitle","author_name","author_about","publisher","publisher_date","publisher_year","format","page_count","language","isbn_10","isbn_13","category","sub_category","average_rating","rating_number","price","features_text","dimensions","item_weight","weight_grams"
"214","The Boy Who Saved Baseball","Paperback – March 17, 2005","John H. Ritter","Novelist John H. Ritter grew up in the dry, chaparral covered hills east of San Diego. ""I grew up in a baseball family,"" says John. ""But we were also a family of musicians and mathematicians, house painters and poets. My dad was a sports writer in Ashtabula, Ohio, who moved the family out west, just before I was born, to become Sports Editor for The San Diego Union."" Growing up in a sparse, mountainous region also helped stretch John's imagination. ""Out in that country,"" he says, ""there was a real sense of the spirits who walked the land in the centuries before. And being so cut off from other kids, I roamed the hills a lot, following hawks and eagles, climbing boulders, sitting in Kumeyaay Indian caves. Rattlesnakes never bothered us much. But I felt the spirits everywhere. I think my mom, who was part Blackfoot Indian, had a lot to do with that."" When John was only four, however, his mother died of breast cancer, leaving his father to raise four small children on his own. John still recalls his mother and her songs. ""One thing I remember about my mom is that she sang to us constantly, making up a song for each of her children that fit our personalities perfectly. So from her, I got a sense of how to capture a person's spirit in a lyrical phrase."" Over time, his musical interests continued to grow and in high school, the social commentary of folksinger Bob Dylan inspired him to write his own songs, hoping to pursue a musical career. He was, however, a “wild student,” he admits to English professor Chris Crowe in an interview for The ALAN Review, and was torn between his love of baseball and writing, calling himself both “a high achiever and a rabble rouser,” noting, for example, that in 1969 he was voted Senior Class President and the Senior Class Clown. Teachers did, however, recognize his writing talent, although his work was so often read out loud in class that he also admits to growing complacent and somewhat lazy about having to improve his skills. At the University of California, San Diego, John studied communications while playing for the UCSD baseball team, all-the-while continuing to write Dylan-style songs. But by his sophomore year, he recalls, “I was anxious to get on with my life. And for the vision I had in mind, college didn’t have much to offer me. I knew I had to walk the streets, touch life, embrace life, gain experience.” So like his literary heroes before him, i.e., Dylan, Jack Kerouac, and Mark Twain, John quit school, taking a job as a painter’s apprentice, and set about traveling the country. He learned to live so cheaply that he could earn enough in three or four months to allow him to travel and write for the rest of the year. He did that for several years, until he married his wife, Cheryl, whom he had met in college, and they had a baby daughter. With a family to support, John needed to work nine months a year, painting houses, but the rest of his time went into writing, an artistic lifestyle he later spotlighted in his song-laden socio-political novel, Under the Baseball Moon. In 1994, after publishing several short stories, John received the Judy Blume Award and a cash grant from the Society of Children’s Book Writers and Illustrators (SCBWI) for a novel in progress. In 1996, he submitted his manuscript through the Curtis Brown Agency to Philomel Books where it became the first book-length acquisition of junior editor, Michael Green. Since then, Green has risen to become Editorial Director and Publisher of Philomel Books and has edited all six of John’s novels. In 1999, John’s first novel, Choosing Up Sides, won the International Reading Association Children’s Book Award for Older Readers and was designated an American Library Association Best Book for Young Adults. The hard-hitting work of historical fiction, set in Southern Ohio, was praised by Kirkus Reviews as, “No ordinary baseball book, this is a rare first novel.” Since then, John has published five more award-winning books and numerous short stories. In 2004, he received the Paterson Prize for Children’s Literature for his third novel, The Boy Who Saved Baseball. Cited in People Magazine as a book to read, “Now that the youngsters have read Harry Potter...”, The Boy Who Saved Baseball also garnered a rave review in Publishers Weekly, which called the book’s prose “Enthralling...at times stunning,” and that, ""Ritter delivers a baseball tale of legendary dimension.” According to Vicki Sherbert, writing in The ALAN Review, “Ritter uses the game of baseball, the glory of music, and the power of the written word to illustrate how young people can overcome everyday, and not-so-everyday, challenges. Each book goes beyond the story of the game, beyond the story of the problem, right to the heart of Ritter's message: What is really valuable in life?” Literary scholar and essayist, Patty Campbell, also notes that, “Another aspect of John H. Ritter’s writing that merits high praise is the variety and inventiveness of his language. Richly evocative metaphors gather layers of meaning as the stories unfold, and the verbal style of each novel is neatly crafted to the place and time of its setting. Under the Baseball Moon dances to a hip hop beachtown beat; Over the Wall wisecracks with a California kid’s take on New York; The Boy Who Saved Baseball draws on both Spanish and English to make up zingy new expressions, and Choosing Up Sides savors the naiveté of the historic Appalachian dialect of southern Ohio. His settings, too, are vividly distinct and vary from the Hispanic/Anglo blend of his own Southern California hill communities to the “small town” neighborhoods of present day New York; from the eclectic oceanfront culture of the Pacific beach towns to the church-centered villages on the banks of the Ohio River during Prohibition.” John’s fifth novel, The Desperado Who Stole Baseball, was a 2009 Jr. Library Guild selection and takes an historical look at the roots of racism in the Major Leagues. Set in the Wild West of the 1880s and written in the manner of a tall tale, Desperado is a prequel to The Boy Who Saved Baseball. John’s sixth novel, Fenway Fever, is also a Junior Library Guild selection and a book his publisher describes as “another magical novel that celebrates teamwork—and the innate power to heal that even the least among us is born with.” New York Times bestselling author Peter Abrahams called Fenway Fever, ""A funny, exciting, original, and heartwarming novel."" “In all of these wonderful novels,” writes Patty Campbell, “John H. Ritter steps up to the plate and hits a home run for teen reading with books that are fun to read, fun to discuss, and important in the difficult process of growing up to be an ethical human being.”","Viking Books for Young Readers","Reprint edition (March 17, 2005",2005,"Paperback",224,"English","0142402869","978-0142402863","Children's Books","Growing Up & Facts of Life",4.7,1616,6.79,"Tom Gallagher is in a tight spot. The fate of the Dillontown team rests on the outcome of one baseball game, winner take all. If Tom's team loses, they lose their field too. But how can they possibly win? Just when everything seems hopeless, a mysterious boy named Cruz de la Cruz rides into town and claims to know the secret of hitting. Not to mention the secrets of Dante Del Gato, Dillontown's greatest hitter ever. Since he walked away from the game years ago, Del Gato hasn't spoken a word to anyone. But now he might be Tom's only hope for saving his hometown. From the award-winning author of | Over the Wall | and | Choosing Up Sides | comes this imaginative tale of one boy's struggle to preserve the spirit of the game he loves.","7.72 x 5.2 x 0.61 inches","5.9 ounces",167.3
"215","Crimes of the Father: A Novel","Hardcover – October 10, 2017","Tom Keneally","Discover more of the author’s books, see similar authors, read author blogs and more","Atria Books","First Edition (October 10, 2017",2017,"Hardcover",352,"English","1501128485","978-1501128486","Literature & Fiction","Genre Fiction",4.1,471,12.88,"From one of our greatest living writers, a bold and timely novel about sin cloaked in sacrament, shame that enforces silence, and the courage of one priest who dares to speak truth to power.Sent away from his native Australia to Canada due to his radical preaching against the Vietnam War, apartheid, and other hot button issues, Father Frank Docherty made for himself a satisfying career as a psychologist and monk. When he returns to Australia to lecture on the future of celibacy and the Catholic Church, he is unwittingly pulled into the lives of two people—a young man, via his suicide note, and an ex-nun—both of whom claim to have been sexually abused by a prominent monsignor.  As a member of the commission investigating sex abuse within the Church, and as a man of character and conscience, Docherty decides he must confront each party involved and try to bring the matter to the attention of both the Church and the secular authorities. What follows will shake him to the core and call into question many of his own choices.  This riveting, profoundly thoughtful novel is “the work of a richly experienced and compassionate writer [with] an understanding of a deeply wounded culture” ( | Sydney Morning Herald | ). It is an exploration of what it is to be a person of faith in the modern world, and of the courage it takes to face the truth about an institution you love.","6 x 1.1 x 9 inches","1.35 pounds",612.3
"216","Secret Son","Paperback – March 9, 2010","Laila Lalami","Laila Lalami was born in Rabat and educated in Morocco, Great Britain, and the United States. She the author of four novels, including 'The Moor’s Account', which won the American Book Award and was a finalist for the Pulitzer Prize, and 'The Other Americans', which was a Los Angeles Times bestseller and a finalist for the National Book Award. Her essays and criticism have appeared in The Nation, Harper’s, the Washington Post, and the New York Times. She has received fellowships from the British Council, the Fulbright Program, and the Guggenheim Foundation and is currently a professor of creative writing at the University of California at Riverside. She lives in Los Angeles.","Algonquin Books","Reprint edition (March 9, 2010",2010,"Paperback",320,"English","1565129792","978-1565129795","Literature & Fiction","Genre Fiction",4.2,261,11.83,"Raised by his mother in a one-room house in the slums of Casablanca, Youssef El Mekki has always had big dreams of living another life in another world. Suddenly his dreams are within reach when he discovers that his father―whom he’d been led to believe was dead―is very much alive. A wealthy businessman, he seems eager to give his son a new start. Youssef leaves his mother behind to live a life of luxury, until a reversal of fortune sends him back to the streets and his childhood friends. Trapped once again by his class and painfully aware of the limitations of his prospects, he becomes easy prey for a fringe Islamic group.In the spirit of | The Inheritance of Loss | and | The Reluctant Fundamentalist | , Laila Lalami’s debut novel looks at the struggle for identity, the need for love and family, and the desperation that grips ordinary lives in a world divided by class, politics, and religion.","5.5 x 0.9 x 8.3 inches","10.9 ounces",309
"217","Just an Illusion - EP: EP (The Illusion Series)","Paperback – June 21, 2017","D. Kelly","D. Kelly, author of The Acceptance Series, The Illusion Series, and standalone companion novels Chasing Cassidy and Sharing Rylee, was born and raised in Southern California. She’s a wife, mom, dog lover, taxi, problem fixer, and extreme multi-tasker. She married her high school sweetheart and is her kids’ biggest fan. Kelly has been writing since she was young and took joy in spinning stories to her childhood friends. Margaritas and sarcasm make her smile, she loves the beach but hates the sand, and she believes Starbucks makes any day better. A contemporary romance writer, D. Kelly’s stories revolve around friendship and the bond it creates, strengthening the love of the people who share it. For all things D. Kelly, you can visit her website: http://www.dkellyauthor.com More places you can follow Dee Website: www.dkellyauthor.com Mailing List: www.dkellyauthor.com/mailing-list Blog: www.dkellyauthor.com/blog Facebook: www.facebook.com/dkellyauthor Reader Group: www.facebook.com/groups/239952459522719 Twitter: @dkellyauthor Instagram: https://www.instagram.com/d_kelly_author/ Google+ plus.google.com/+DeeKellyAuthor/posts","CreateSpace Independent Publishing Platform","1st edition (June 21, 2017",2017,"Paperback",462,"English","1548152080","978-1548152086","Romance","Contemporary",4.8,963,18.99,"Lives are turned upside down … Everything was perfect before life came to a screeching halt. When devastating loss flips Amelia’s world on its axis, she loses her spirit. Mel isn’t the only one hurting, though; the members of BAD are also struggling to find their way after that tragic night. Life goes on … Amelia’s friends move heaven and earth to help ease her sadness. Knowing she’s on a dangerous precipice, they fight through their own pain to bring her safely to the other side of her grief. Love can conquer … Amelia knows bottling up her feelings isn’t helping anything. With love at her fingertips, all she has to do is reach for it. Mel’s loved ones desperately hope she can once again find her way to happiness. Can Amelia overcome her fears to let love in again, or will she let the weight of that night continue to drown her in sorrow? Just an Illusion – EP is book three in The Illusion Series","5.51 x 1.03 x 8.5 inches","1.28 pounds",580.6
"218","I'm Supposed to Protect You from All This: A Memoir","","Nadja Spiegelman","Nadja Spiegelman's forthcoming memoir, ""I'm Supposed to Protect You from All This,"" will be published by Riverhead Books in August 2016. She is the Eisner-award nominated author of the ZIG AND WIKKI graphic series for young children and ""Lost in NYC: A Subway Adventure.""","Riverhead Books","Reprint edition (August 1, 2017",2017,"Paperback",384,"English","0399573070","978-0399573071","Self-Help","Death & Grief",4.2,341,14.99,"A | Vogue | Best Book of the Year""What Ferrante did for female friends—exploring the tumult and complexity their relationships could hold—Spiegelman sets out to do for mothers and daughters. She’s essentially written My Brilliant Mom."" | —Slate | A memoir of mothers and daughters—and mothers as daughters—traced through four generations, from Paris to New York and back again. | For a long time, Nadja Spiegelman believed her mother was a fairy. More than her famous father, | Maus | creator Art Spiegelman, and even more than most mothers, hers—French-born | New Yorker | art director Françoise Mouly—exerted a force over reality that was both dazzling and daunting. As Nadja’s body changed and “began to whisper to the adults around me in a language I did not understand,” their relationship grew tense. Unwittingly, they were replaying a drama from her mother’s past, a drama Nadja sensed but had never been told. Then, after college, her mother suddenly opened up to her. Françoise recounted her turbulent adolescence caught between a volatile mother and a playboy father, one of the first plastic surgeons in France. The weight of the difficult stories she told her daughter shifted the balance between them.                  It had taken an ocean to allow Françoise the distance to become her own person. At about the same age, Nadja made the journey in reverse, moving to Paris determined to get to know the woman her mother had fled.  Her grandmother’s memories contradicted her mother’s at nearly every turn, but beneath them lay a difficult history of her own. Nadja emerged with a deeper understanding of how each generation reshapes the past in order to forge ahead, their narratives both weapon and defense, eternally in conflict. Every reader will recognize herself and her family in | I'm Supposed to Protect You From All This, | a gorgeous and heartbreaking memoir that helps us to see why sometimes those who love us best hurt us most.","5.5 x 0.9 x 8.26 inches","11.2 ounces",317.5
"219","How to Train Your Parents","Paperback – International Edition, April 22, 2003","Pete Johnson","Discover more of the author’s books, see similar authors, read author blogs and more","Yearling","April 22, 2003",2003,"Paperback",119,"English","0440864399","978-0440864394","Children's Books","",4.6,2267,11.6,"The tale of a boy who is fed up with his hyper-competitive parents.Moving to a new neighbourhood and a new school, Louis’s parents become ultra-competitive parents, wanting him and his brother to get straight As at school and join all sorts of after-school clubs and activities like the other kids in the neighbourhood. Suddenly Louis’s life is no longer his own. Then he meets Maddy, who claims to have trained her parents to ignore her. But does Louis really want to be ignored?","5.13 x 0.51 x 7.65 inches","5.2 ounces",147.4
"220","Tombstone: The Great Chinese Famine, 1958-1962","Hardcover – October 30, 2012","Jisheng Yang","Discover more of the author’s books, see similar authors, read author blogs and more","Farrar, Straus and Giroux","First English Language Edition (October 30, 2012",2012,"Hardcover",656,"English","0374277931","978-0374277932","Politics & Social Sciences","Politics & Government",4.4,404,48.54,"The much-anticipated definitive account of Chinas Great Famine  An estimated thirty-six million Chinese men, women and children starved to death during Chinas Great Leap Forward in the late 1950s and early 60s. One of the greatest tragedies of the twentieth century, the famine is poorly understood, and in China is still euphemistically referred to as the three years of natural disaster. As a journalist with privileged access to official and unofficial sources, Yang Jisheng spent twenty years piecing together the events that led to mass nationwide starvation, including the death of his own father. Finding no natural causes, Yang lays the deaths at the feet of Chinas totalitarian system and the refusal of officials at every level to value human life over ideology and self-interest. Tombstone is a testament to inhumanity and occasional heroism that pits collective mem","6.37 x 1.89 x 9.31 inches","2.05 pounds",929.9
"221","Visible Learning","1st Edition","John Hattie","John Hattie is Professor of Education and Director of the Visible Learning Labs, University of Auckland, New Zealand. Photo by User:idunius (Own work) [CC BY-SA 3.0 (http://creativecommons.org/licenses/by-sa/3.0)], via Wikimedia Commons.","Routledge","1st edition (December 26, 2008",2008,"Paperback",392,"English","0415476186","978-0415476188","Education & Teaching","Schools & Teaching",4.6,336,24.86,"This unique and ground-breaking book is the result of 15 years research and synthesises over 800 meta-analyses on the influences on achievement in school-aged students. It builds a story about the power of teachers, feedback, and a model of learning and understanding. The research involves many millions of students and represents the largest ever evidence based research into what actually works in schools to improve learning. Areas covered include the influence of the student, home, school, curricula, teacher, and teaching strategies. A model of teaching and learning is developed based on the notion of visible teaching and visible learning. | A major message is that what works best for students is similar to what works best for teachers – an attention to setting challenging learning intentions, being clear about what success means, and an attention to learning strategies for developing conceptual understanding about what teachers and students know and understand. | Although the current evidence based fad has turned into a debate about test scores, this book is about using evidence to build and defend a model of teaching and learning. A major contribution is a fascinating benchmark/dashboard for comparing many innovations in teaching and schools.","6.85 x 0.89 x 9.69 inches","1.9 pounds",861.8
"222","Mitzy Moon Mysteries Books 1-3: Paranormal Cozy Mystery (Mitzy Moon Mysteries Box Set)","Paperback – Large Print, November 24, 2020","Trixie Silvertale","USA TODAY Bestselling author Trixie Silvertale grew up reading an endless supply of Lilian Jackson Braun, Hardy Boys, and Nancy Drew novels. She loves the amateur sleuths in cozy mysteries and is obsessed with all things paranormal. Those two passions unite in her Mitzy Moon Mysteries, and she's thrilled to write them and share them with you. When she's not consumed by writing, she bakes to fuel her creative engine and tends to her herb garden. Visit her online at: www.TrixieSilvertale.com","Sittin' On A Goldmine Productions LLC","Large type / Large print edition (November 24, 2020",2020,"Paperback",828,"English","1952739497","978-1952739491","Mystery, Thriller & Suspense","Mystery",4.7,1622,29.99,"Mitzy Moon is a barista in a latte trouble… | No sooner does she set foot in the quirky village of Pin Cherry Harbor to claim her inheritance, than the handsome sheriff catches her standing over a corpse. Desperate to prove her innocence, she’s forced to accept help from her granny’s entitled cat and a spirit from beyond the grave. | Over 800 pages of sleuthing fun! | The Mitzy Moon Mysteries : Books 1-3 includes the first three books in the hilarious paranormal cozy mystery series, | PLUS | a never-before-released map of Pin Cherry. If you like snarky heroines, supernatural misfits, and a dash of romance, then you'll love Trixie Silvertale’s twisty whodunits. | Find out why readers are so addicted to this series… | Buy this Mitzy Moon Mysteries: Books 1-3 to serve up the guilty today! | What Amazon readers are saying: | ★★★★★ 'Fun, witty, entertaining cozy mystery.’ | ★★★★★ 'A ghost grandma, a real wild cat, and a girl named after a cheese… What's not to love?’ | ★★★★★ 'Extremely well-written paranormal cozy!’ | ★★★★★ 'A perfect book, one that has me craving more…’ | ★★★★★ 'Best cozy mystery I've read in a long time…won't disappoint!’ | Book 1 – Fries and Alibis: Paranormal Cozy Mystery | A gift that’s too good to be true. A murder she didn’t commit. A barista in a latte trouble… | Book 2 – Tattoos and Clues: Paranormal Cozy Mystery | A beachside stroll. A deadly discovery. Will this psychic sleuth swim or sink? | Book 3 – Wings and Broken Things: Paranormal Cozy Mystery | A crime with no eyewitness. A determined psychic sleuth. Will her search for clues take her where angels fear to tread?","6 x 1.87 x 9 inches","2.63 pounds",1192.9
"223","Mrs. Jeffries Appeals the Verdict (A Victorian Mystery)","","Emily Brightwell","Emily Brightwell was born in the Appalachian mountains of West Virginia. Her family moved to Southern California in 1959 and she grew up in Pasadena. After graduating from California State University Fullerton, she decided to work her way around the world and started in England. She didn't get any further because she met future her husband there, got married and moved back to California. While living in Long Beach, she decided to pursue her dream and become a writer - despite having two children and a full-time job. She began the Mrs. Jeffries series in 1993 with ""The Inspector and Mrs. Jeffries"" and has written forty more mysteries in the series in the following twenty-nine years. Emily has just finished (January 23) writing the next Mrs. Jeffries mystery : ""Mrs. Jeffries Aims to Win"" to be published in August 2023. Almost all books are available as audio books (unabridged) and most are available in large print format. Now that her children are grown and have left home - Emily and her husband live in Northern Nevada. Her books are also sold in the United Kingdom, Japan, and Hungary. Emily is a relieved Everton FC supporter, loves Korean TV dramas, and ""high altitude"" baking.","Berkley","First Edition (May 2, 2006",2006,"",NA,"English","0425209695","978-0425209691","Mystery, Thriller & Suspense","Mystery",4.6,463,7.99,"GUILTY BYSTANDERS | After a perfectly decent local woman is killed during a robbery, the Witherspoon household receives a surprising visit from a stranger named Blimpey Groggins. He claims his best buddy was convicted of the crime. He also claims the peaceable chap didn’t even know how to fire a gun. And considering he’s to be hanged in three weeks, Blimpey’s desperate to find the real killer. With the trail cold, the crime allegedly solved, and the evidence mucked up, Mrs. Jeffries and her belowstairs cohorts have their work cut out for them if they want to save an innocent man from the gallows. | A Mrs. Jeffries Mystery | She keeps house for Inspector Witherspoon…and keeps him on his toes. Everyone’s awed by his Scotland Yard successes—but they don’t know about his secret weapon. No matter how messy the murder or how dirty the deed, Mrs. Jeffries’ polished detection skills are up to the task…proving that behind every great man there’s a woman—and that a crimesolver’s work is never done. | First Time in Print!","4.23 x 0.6 x 6.7 inches","3.84 ounces",108.9
