"","title","subtitle","author_name","author_about","publisher","publisher_date","publisher_year","format","page_count","language","isbn_10","isbn_13","category","sub_category","average_rating","rating_number","price","features_text","dimensions","item_weight","weight_grams"
"154","The Earl Claims His Wife (Scandals and Seductions, 2)","","Cathy Maxwell","Cathy Maxwell has written over forty historical romances known for love and laughter, hit the New York Times and USA Today lists, been nominated for or won some nice awards, made dynamite reading and writing friends, AND has had the time of her life. To discover more about Cathy and her books, visit www.cathymaxwell.com to sign up for her occasional newsletters. Or, follow her on FB, Instagram, Twitter, and TikTok at maxwellcathy. For a list of Cathy Maxwell's books--www.cathymaxwell.com #HistoricaRomance #LoveandLaughter #MarriageofConvenience #RomanceNovels","Avon","Original edition (September 29, 2009",2009,"",NA,"English","0061350990","978-0061350993","Romance","Historical",4.3,212,8.54,"The Earl Claims His Wife | is the latest romance from | New York Times | bestselling author Cathy Maxwell in her new Scandal and Seductions series, where pride clashes with passion and temptation leads to love. Preoccupied with wars and women, the earl ignored his wife. But when he finally wants her by his side, the fiery Lady Gillian won’t go without a fight . . .","4.19 x 0.92 x 6.75 inches","6.3 ounces",178.6
"155","Light of Impossible Stars: An Embers of War Novel","Paperback – February 18, 2020","Gareth L. Powell","Gareth L. Powell is a British author known for using fast-paced, character-driven science fiction to explore big ideas and themes of identity, loss, and the human condition. He has twice won the coveted British Science Fiction Association Award for Best Novel, and has become one of the most-shortlisted authors in the award’s 50-year history. He has also been a finalist for the Locus, British Fantasy, Seiun, and Canopus awards. If you click the 'follow' button, Amazon will send you an email when he has a new release, or if there's a special deal you might be interested in. It's the best way to make sure you never miss a book!","Titan Books","February 18, 2020",2020,"Paperback",400,"English","1785655248","978-1785655241","Science Fiction & Fantasy","Science Fiction",4.1,1487,15.95,"BSFA Award-winning author Gareth L. Powell delivers an explosive conclusion to his epic | Embers of War | trilogy. | Low on fuel and hunted by the Fleet of Knives, the sentient warship Trouble Dog follows a series of clues that lead her to the Intrusion--an area of space where reality itself becomes unstable. But with human civilisation crumbling, what difference can one battered old ship have against an invincible armada?Meanwhile, Cordelia Pa and her step-brother eke out their existence salvaging artefacts from an alien city. But when Cordelia starts hearing the city's song in her head, strange things start happening around her. What extraordinary affinity does she have for this abandoned technology, and how can it possibly help the Trouble Dog?Award-winning author Gareth L. Powell delivers an explosive conclusion to his epic | Embers of War | trilogy.","7.39 x 0.32 x 10.09 inches","13 ounces",368.5
"156","Picture Me Gone","Hardcover – October 3, 2013","Meg Rosoff","Meg Rosoff was born in Boston, educated at Harvard and St Martin’s College of Art, and worked in New York City for ten years before moving to London permanently in 1989. She worked in publishing, politics, PR and advertising until 2004, when she wrote her first novel, How I Live Now, which won the Guardian Children’s fiction prize (UK), Michael L Printz prize (US), the Die Zeit children’s book of the year (Germany) and was shortlisted for the Orange first novel award. Her second novel, Just in Case, won the 2007 Carnegie Medal. Meg’s latest book is The Bride’s Farewell. She lives in London with her husband, daughter and two very hairy dogs.","G.P. Putnam's Sons Books for Young Readers","First Edition (October 3, 2013",2013,"Hardcover",256,"English","0399257659","978-0399257650","Teen & Young Adult","Literature & Fiction",4,233,18.63,"Printz Award-winning author Meg Rosoff's latest novel is a gorgeous and unforgettable page-turner about the relationship between parents and children, love and loss.Mila has an exceptional talent for reading a room—sensing hidden facts and unspoken emotions from clues that others overlook. So when her father’s best friend, Matthew, goes missing from his upstate New York home, Mila and her beloved father travel from London to find him. She collects information about Matthew from his belongings, from his wife and baby, from the dog he left behind and from the ghosts of his past—slowly piecing together the story everyone else has missed. But just when she’s closest to solving the mystery, a shocking betrayal calls into question her trust in the one person she thought she could read best.","5.75 x 0.9 x 8.5 inches","13.2 ounces",374.2
"157","Homegoing","Paperback – May 2, 2017","Yaa Gyasi","Yaa Gyasi was born in Ghana and raised in Huntsville, Alabama. Her debut novel, Homegoing, was awarded the National Book Critics Circle’s John Leonard Award for best first book, the PEN/Hemingway Award for a first book of fiction, the National Book Foundation’s “5 under 35” honors for 2016, and the American Book Award. She lives in Brooklyn.","Knopf Doubleday Publishing Group","Reprint edition (May 2, 2017",2017,"Paperback",320,"English","1101971061","978-1101971062","Literature & Fiction","United States",4.6,36338,11.58,"A | NEW YORK TIMES | NOTABLE BOOK • | Ghana, eighteenth century: two half sisters are born into different villages, each unaware of the other. One will marry an Englishman and lead a life of comfort in the palatial rooms of the Cape Coast Castle. The other will be captured in a raid on her village, imprisoned in the very same castle, and sold into slavery. | One of Oprah’s Best Books of the Year and a PEN/Hemingway award winner, | Homegoing | follows the parallel paths of these sisters and their descendants through eight generations: from the Gold Coast to the plantations of Mississippi, from the American Civil War to Jazz Age Harlem. Yaa Gyasi’s extraordinary novel illuminates slavery’s troubled legacy both for those who were taken and those who stayed—and shows how the memory of captivity has been inscribed on the soul of our nation.","5.17 x 0.73 x 7.98 inches","8 ounces",226.8
"158","Hellspark","Paperback – January 2, 1998","Janet Kagan","Discover more of the author’s books, see similar authors, read author blogs and more","Meisha Merlin Publishing Inc.","1st edition (January 2, 1998",1998,"Paperback",336,"English","0965834522","978-0965834520","Science Fiction & Fantasy","Science Fiction",4.7,501,6.63,"Murder, Mystery, and Interstellar Intrigue! Hugo Award winner Janet Kagan's Hellspark is now back in print! Lassti, a newly discovered planet, is the center of political intrigue. Recently, Oloitokitok, the planet survey team's physicist was found dead. Was he killed? If so, by who? One of his fellow surveyors? Or by one of the Sprookjes, the birdlike natives of Lassti? Are the Sprookjes intelligent? If so, then parties that want the planet for development will lose it. Why is the survey team having so much trouble finding out? Into this situation arrives Tocohl, a Hellspark trader who just wanted to have a vacation on Sheveschke at the St. Veschke festival. After being attacked, rescuing a young woman, and going before a judge, Tocohl has learned all she ever wanted to know about being in the wrong place at the wrong time. Now she is on her way to find Lasti to find answers to the mysteries there.","5.75 x 0.75 x 9 inches","13.6 ounces",385.6
"159","Cute & Easy Crochet: Learn to crochet with 35 adorable projects","Kindle Edition","Nicki Trench","Discover more of the author’s books, see similar authors, read author blogs and more","CICO Books","US edition (February 21, 2014",2014,"",NA,"English","","","Crafts, Hobbies & Home","Crafts & Hobbies",4.6,356,19.49,"Expert crafter Nicki Trench brings you 35 easy-to-follow crochet patterns that will teach you how to crochet. A crochet teacher and author with over 20 years' experience, Nicki has designed a series of patterns that will guide you through those initial stitches to producing beautiful projects incorporating a wide range of crochet techniques. Crochet Know-how explains all the stitches with clear step-by-step artworks and instructions. Next, discover three chapters packed with patterns to improve your skills. First is Starting Out, where you will find a simple springtime throw and a pretty hat for a toddler - you'll be amazed how easy and quick the projects are to create. Once you've mastered these, move on to something more challenging in the Practice Makes Perfect chapter. There are cute gifts for babies and young children, including baby blocks, bibs and blankets, or treat yourself to a pair of gloves in soft double knit yarn or the chunky seashells scarf to keep you warm on chilly mornings. Finally, Confident Crocheting has more advanced patterns, from a family of adorable Russian dolls to the cherub dress with decorative picot stitching.Nicki Trench is one of the leading figures in the revival and promotion of home crafts. She is the founder of Laughing Hens , the UK's leading online yarn store, and Rooster Yarns . Some of her books include Cute & Easy Crocheted Baby Clothes , A Passion for Quilting and Super Scary Crochet . Visit her website at nickitrench.com and blog at nickitrench.blogspot.com.","","",NA
"160","Legal Tender","Mass Market Paperback – July 18, 1997","Lisa Scottoline","Lisa Scottoline is a #1 bestselling and Edgar Award-winning author of 33 novels. Lisa's books are book-club favorites, and she and her daughter Francesca Serritella have hosted an annual Big Book Club Party for over a thousand readers at her Pennsylvania farm, for the past twelve years. Lisa has been President of Mystery Writers of America and she reviews fiction and non-fiction for the New York Times, Washington Post, and The Philadelphia Inquirer. She also writes a weekly column with her daughter for The Philadelphia Inquirer entitled Chick Wit, a witty take on life from a woman’s perspective, which have been collected in a bestselling series of humorous memoirs. Lisa graduated magna cum laude in three years from the University of Pennsylvania, with a B.A. degree in English, and cum laude from the University of Pennsylvania Law School, where she taught Justice & Fiction. She has over 30 million copies of her books in print and is published in over 35 countries. She lives with an array of disobedient pets, and wouldn’t have it any other way.","HarperTorch","First Edition (July 18, 1997",1997,"",NA,"English","0061094129","978-0061094125","Mystery, Thriller & Suspense","Thrillers & Suspense",4.2,2716,6.68,"Bennie Rosato is a maverick lawyer, and business at her law firm has never been better. Then, without warning, a savage murder tears the firm apart. All evidence points to Bennie, who has motive aplenty and an unconfirmable alibi. Her world turns upside-down as the lawyer becomes the client, and the law is now after her. When another killing takes place, Bennie runs for her life, a fugitive armed only with her wits and courage. She is determined to find the real killer -- or die trying.","4 x 1.25 x 6.75 inches","1 pounds",453.6
"161","Little House Living: The Make-Your-Own Guide to a Frugal, Simple, and Self-Sufficient Life","Kindle Edition","Merissa Alink","Merissa Alink loves living the simple life and blogging about it at www.LittleHouseLiving.com. Merissa and her family live on a small farm in South Dakota where she makes the most with what she has and believes she can show you how to do the same, no matter where you live or what your income level is.","Gallery Books","Reprint edition (October 20, 2015",2015,"",NA,"English","","","Crafts, Hobbies & Home","Home Improvement & Design",4.7,489,16.99,"The immensely popular blogger behind | Little House Living | provides a timeless and “heartwarming guide to modern homesteading” ( | BookPage | ) that will inspire you to live your life simply and frugally—perfect for fans of | The Pioneer Woman | and | The Hands-On Home. | Shortly after getting married, Merissa Alink and her husband found themselves with nothing in their pantry but a package of spaghetti and some breadcrumbs. Their life had seemingly hit rock bottom, and it was only after a touching act of charity that they were able to get back on their feet again. Inspired by this gesture of kindness as well as the beloved Little House on the Prairie books, Merissa was determined to live an entirely made-from-scratch life, and as a result, she rescued her household budget—saving thousands of dollars a year. Now, she reveals the powerful and moving lessons she’s learned after years of homesteading, homemaking, and cooking from scratch. Filled with charm, practical advice, and gorgeous full-color photographs, Merissa shares everything from tips on budgeting to natural, easy-to-make recipes for taco seasoning mix, sunscreen, lemon poppy hand scrub, furniture polish, and much more. Inviting and charming, | Little House Living | is the epitome of heartland warmth and prairie inspiration.","","",NA
"162","Discourse on Colonialism","Paperback – January 1, 2001","Aimé Césaire","Discover more of the author’s books, see similar authors, read author blogs and more","Monthly Review Press","January 1, 2001",2001,"Paperback",102,"English","1583670254","978-1583670255","Politics & Social Sciences","Politics & Government",4.7,491,14.99,"""Césaire's essay stands as an important document in the development ofthird world consciousness--a process in which [he] played a prominentrole.""--Library Journal This classic work, firstpublished in France in 1955, profoundly influenced the generation ofscholars and activists at the forefront of liberation struggles inAfrica, Latin America, and the Caribbean. Nearly twenty years later,when published for the first time in English, | Discourse on Colonialism | inspired a new generation engaged in the Civil Rights, Black Power, andanti-war movements and has sold more than 75,000 copies to date. Aimé Césaire eloquently describes the brutal impact of capitalism andcolonialism on both the colonizer and colonized, exposing thecontradictions and hypocrisy implicit in western notions of ""progress""and ""civilization"" upon encountering the ""savage,"" ""uncultured,"" or""primitive."" Here, Césaire reaffirms African values, identity, andculture, and their relevance, reminding us that ""the relationshipbetween consciousness and reality are extremely complex. . . . It isequally necessary to decolonize our minds, our inner life, at the sametime that we decolonize society."" An interview with Césaire by the poetRené Depestre is also included.","5.4 x 0.3 x 7.7 inches","4 ounces",113.4
"163","The Emotional Incest Syndrome: What to do When a Parent's Love Rules Your Life","Paperback – February 1, 1991","Patricia Love","Patricia Love, Ed.D., is an acclaimed therapist and speaker and author/co-author of six books, including Hot Monogamy, The Truth About Love and How to Improve Your Marriage Without Talking About It. She has appeared on Oprah and Today and on CNN, and has contributed to numerous magazines including Cosmopolitan, Men's Health, Woman's World. Pat has a private practice in Austin, TX where she works primarily with couples in an ""intensive model"" she developed over her years of clinical experience. Couples come for three hours up to three days to work on the important issues in their relationship. This natural, organic process is highly effective as it addresses the strengths as well as challenges presented by each individual couple. Dr. Love (yes, that's her real name!) also conducts trainings for therapists and counselors based on an evidence-based approach. Utilizing her love for research and curriculum development, she offers a multitude of instructional experiences addressing such timely topics as relationships, marriage, divorce, sexuality, infidelity and recovery, depression, anxiety, loneliness, happiness, addiction, recovery and love in the time of Twitter. When you work with Pat, whether as a client or a participant in one of her trainings you will notice her warmth, humor and commitment to learning. This combination makes her books, her teaching, her coaching and her therapy a meaningful investment.","Bantam","February 1, 1991",1991,"Paperback",304,"English","055335275X","978-0553352757","Health, Fitness & Dieting","Psychology & Counseling",4.6,368,16.39,"From Dr. Patricia Love, a ground-breaking work that identifies, explores and treats the harmful effects that emotionally and psychologically invasive parents have on their children, and provides a program for overcoming the chronic problems that can result.","5.3 x 0.6 x 8.1 inches","12 ounces",340.2
"164","The Exiles Return: A Novel","Kindle Edition","Elisabeth De Waal","Discover more of the author’s books, see similar authors, read author blogs and more","Picador","January 7, 2014",2014,"",NA,"English","","","Literature & Fiction","Genre Fiction",3.8,243,11.99,"WITH A FOREWORD BY EDMUND DE WAAL, AUTHOR OF | THE HARE WITH AMBER EYES | SET IN THE ASHES OF POST–SECOND WORLD WAR VIENNA, A POWERFUL, SUBTLE NOVEL OF EXILES RETURNING HOME FIFTEEN YEARS AFTER FLEEING HITLER'S DEADLY REIGN Vienna is demolished by war, the city an alien landscape of ruined castles, a fractured ruling class, and people picking up the pieces. Elisabeth de Waal's mesmerizing | The Exiles Return | is a stunningly vivid postwar story of Austria's fallen aristocrats, unrepentant Nazis, and a culture degraded by violence.The novel follows a number of exiles, each returning under very different circumstances, who must come to terms with a city in painful recovery. There is Kuno Adler, a Jewish research scientist, who is tired of his unfulfilling existence in America; Theophil Kanakis, a wealthy Greek businessman, seeking to plunder some of the spoils of war; Marie-Theres, a brooding teenager, sent by her parents in hopes that the change of scene will shake her out of her funk; and Prince ""Bimbo"" Grein, a handsome young man with a title divested of all its social currency.With immaculate precision and sensitivity, de Waal, an exile herself, captures a city rebuilding and relearning its identity, and the people who have to do the same. Mesmerizing and tragic, de Waal has written a masterpiece of European literature, an artifact revealing a moment in our history, clear as a snapshot, but timeless as well.","","",NA
"165","The Bite Before Christmas","","Jeaniene Frost","Jeaniene Frost is the New York Times, USA Today, and international bestselling author of the Night Huntress series, the Night Prince series, the Broken Destiny series, and the Night Rebel series. To date, foreign rights for Jeaniene's novels have sold to twenty different countries. Jeaniene lives in Florida with her husband Matthew, who long ago accepted that she rarely cooks and always sleeps in on the weekends. Aside from writing, Jeaniene enjoys reading, poetry, watching movies, exploring old cemeteries, spelunking, and traveling - by car. Airplanes, children, and cook books frighten her. For more information on Jeaniene's books, go to: http://www.jeanienefrost.com/","Avon","Reprint edition (January 1, 2012",2012,"",NA,"English","0062022601","978-0062022608","Mystery, Thriller & Suspense","Thrillers & Suspense",4.5,1035,7.35,"With | The Bite Before Christmas | , | New York Times | bestsellers Lynsay Sands and Jeaniene Frost—two of the hottest names in paranormal romance—team up for the first time to bring lucky readers a holiday anthology…with teeth! Here are delightful brand new stories featuring familiar faces from their enormously popular Argeneau family and Night Huntress series. Lynsay and Jeaniene’s legion of loyal fans will flock to these unforgettable novellas celebrating the dreams and desires of immortals at Yuletide. Better than a midnight visit from Santa Claus, | The Bite Before Christmas | proves that nobody does sexy vampires better than Sands and Frost.","4.19 x 0.92 x 6.75 inches","6.5 ounces",184.3
"166","Two Truths and a Lie: It's Alive!","Hardcover – June 27, 2017","Ammi-Joan Paquette","Ammi-Joan (A.J.) Paquette spent her formative years moving from place to place, which left her with an insatiable curiosity about the wide world and everything in it. A voracious reader since early childhood, she's thrilled to now be able to share her stories with readers everywhere. She lives outside of Boston, Massachusetts, where she balances her own writing and her day job as a literary agent. Visit her on the web at www.ajpaquette.com","Walden Pond Press","Illustrated edition (June 27, 2017",2017,"Hardcover",176,"English","0062418793","978-0062418791","Children's Books","Activities, Crafts & Games",4.7,220,32,"“Considering the fresh attention being paid to teaching a skeptical approach to information evaluation, this series opener couldn’t be better timed. A brief but savvy guide to responsible research methods adds further luster to this crowd pleaser.” —ALA | Booklist | (starred review) | Two Truths and a Lie | is the first book in a fascinating new series that presents some of the most crazy-but-true stories about the living world as well as a handful of stories that are too crazy to be true—and asks readers to separate facts from fakes! | Did you know that there is a fungus that can control the mind of an ant and make it do its bidding? Would you believe there is such a thing as a corpse flower—a ten-foot-tall plant with a blossom that smells like a zombie? How about a species of octopus that doesn’t live in water but rather lurks in trees in the Pacific Northwest? | Every story in this book is strange and astounding. But not all of them are real. Just like the old game in this book’s title, two out of every three stories are completely true and one is an outright lie. Can you guess which? It’s not going to be easy. Some false stories are based on truth, and some of the true stories are just plain unbelievable. And they’re all accompanied by dozens of photos, maps, and illustrations. Amaze yourself and trick your friends as you sort out the fakes from the facts! | Acclaimed authors Ammi-Joan Paquette and Laurie Ann Thompson have teamed up to create a series of sneaky stories about the natural world designed to amaze, disgust, and occasionally bamboozle you.","7 x 0.67 x 9 inches","1.48 pounds",671.3
"167","In Real Life","Paperback – October 14, 2014","Cory Doctorow","Cory Doctorow (craphound.com) is a science fiction author, activist and journalist. He is the author of many books, most recently RADICALIZED and WALKAWAY, science fiction for adults; CHOKEPOINT CAPITALISM, nonfiction about monopoly and creative labor markets; IN REAL LIFE, a graphic novel; and the picture book POESY THE MONSTER SLAYER. His latest novel is ATTACK SURFACE, a standalone adult sequel to LITTLE BROTHER. In 2020, he was inducted into the Canadian Science Fiction and Fantasy Hall of Fame.","First Second","October 14, 2014",2014,"Paperback",192,"English","1596436581","978-1596436589","Teen & Young Adult","Literature & Fiction",4.5,1213,13.49,"A NEW YORK TIMES BESTSELLER | From acclaimed teen author Cory Doctorow and rising star cartoonist Jen Wang, | In Real Life | is a sensitive, thoughtful look at adolescence, gaming, poverty, and culture-clash. | Anda loves Coarsegold Online, the massively-multiplayer role playing game that she spends most of her free time on. It's a place where she can be a leader, a fighter, a hero. It's a place where she can meet people from all over the world, and make friends. Gaming is, for Anda, entirely a good thing. But things become a lot more complicated when Anda befriends a gold farmer -- a poor Chinese kid whose avatar in the game illegally collects valuable objects and then sells them to players from developed countries with money to burn. This behavior is strictly against the rules in Coarsegold, but Anda soon comes to realize that questions of right and wrong are a lot less straightforward when a real person's real livelihood is at stake. | This title has common Core connections.","6.14 x 0.59 x 8.47 inches","14.3 ounces",405.4
