"","title","subtitle","author_name","author_about","publisher","publisher_date","publisher_year","format","page_count","language","isbn_10","isbn_13","category","sub_category","average_rating","rating_number","price","features_text","dimensions","item_weight","weight_grams"
"82","Belichick: The Making of the Greatest Football Coach of All Time","Hardcover – September 25, 2018","Ian O'Connor","Ian O’Connor is a nationally-acclaimed columnist who has authored four previous books, including his third New York Times bestseller ""Belichick: The Making of the Greatest Football Coach of All Time;"" O'Connor's previous bestsellers were “The Captain: The Journey of Derek Jeter,” which the Library Journal called “excellent” and the “most complete account” of Jeter’s iconic career with the New York Yankees, and ""Arnie & Jack: Palmer, Nicklaus, and Golf's Greatest Rivalry."" His defining biography of retiring Duke basketball coach Mike Krzyzewski will be published in February. O’Connor has finished in first place in 18 national writing contests, including those conducted by the Associated Press Sports Editors, the Golf Writers Association of America, and the Pro Football Writers of America. He has been a sports columnist at ESPN.com, The (N.J.) Record, USA Today, Gannett (N.Y.) Newspapers, The New York Daily News and, now, The New York Post, and he has hosted national and regional radio shows for ESPN.","Mariner Books","Illustrated edition (September 25, 2018",2018,"Hardcover",512,"English","0544785746","978-0544785748","Sports & Outdoors","Biographies",4.6,1064,16,"A | NEW YORK TIMES | BESTSELLER | The definitive biography of the NFL’s most enigmatic, controversial, and yet successful coach             Bill Belichick is perhaps the most fascinating figure in the NFL—the infamously dour face of one of the winningest franchises in sports. As head coach of the New England Patriots, he’s led the team to five Super Bowl championship trophies. In this revelatory and robust biography, readers will come to understand and see Belichick’s full life in football, from watching college games as a kid with his father, a Naval Academy scout, to orchestrating two Super Bowl–winning game plans as defensive coordinator for the Giants, to his dramatic leap to New England, where he has made history.             Award-winning columnist and | New York Times | best-selling author Ian O’Connor delves into the mind of the man who has earned a place among coaching legends like Lombardi, Halas, and Paul Brown, presenting sides of Belichick that have been previously unexplored. O’Connor discovers how this legendary coach shaped the people he met and worked with in ways perhaps even Belichick himself doesn’t know. Those who follow and love pro football know Bill Belichick only as the hooded genius of the Patriots. But there is so much more—from the hidden tensions and deep layers to his relationship with Tom Brady to his sometimes frosty dealings with owner Robert Kraft to his ability to earn the unmitigated respect of his players—if not their affection. This is a man who has many facets and, ultimately, has created a notorious football dynasty. Based on exhaustive research and countless interviews, this book circles around Belichick to tell his full story for the first time, and presents an incisive portrait of a mastermind at work.","6 x 1.7 x 9 inches","1.7 pounds",771.1
"83","Lymond Chronicles 06 Checkmate","Paperback – International Edition, February 2, 1999","Dorothy Dunnett","DOROTHY DUNNETT was born in Dunfermline, Scotland. She is the author of the Francis Crawford of Lymond novels; the House of Niccolò novels; seven mysteries; King Hereafter, an epic novel about Macbeth; and the text of The Scottish Highlands, a book of photographs by David Paterson, on which she collaborated with her husband, Sir Alastair Dunnett. In 1992 she was made an Officer of the Order of the British Empire for services to literature. Lady Dunnett died in 2001.","Penguin UK","February 2, 1999",1999,"Paperback",592,"English","0140282386","978-0140282382","Literature & Fiction","Genre Fiction",4.7,424,23.03,"Before George R. R. Martin there was Dorothy Dunnett . . . THE PERFECT GIFT for fans of A Game of Thrones. 'She is a brilliant story teller, The Lymond Chronicles will keep you reading late into the night, desperate to know the fate of the characters you have come to care deeply about.' The Times Literary Supplement Checkmate is the sixth and final book in the series ----------------------------- 'If they place the sun in my right hand and the moon in my left and ask me to give up my mission, I will not give it up until the truth prevails or I myself perish in the attempt . . .' It is 1557 and legendary Scottish warrior Francis Crawford of Lymond is once more in France. There he is leading an army to rout the hated English from Calais. Yet while Lymond seeks victory on the battlefield he is haunted by his troubled past - chiefly the truth about his origins and his marriage (in name only) to young Englishwoman Philippa Somerville. As the French offer him a way out of his marriage and his wife appears in France on a mission of her own, the final moves are made in a great game that has been playing out over an extraordinary decade of war, love and struggle - bringing the Lymond Chronicles to a spellbinding close. 'A masterpiece of historical fiction' Washington Post 'Melodrama of the most magnificent kind' The Guardian","5 x 1.62 x 7.8 inches","1.03 pounds",467.2
"84","The Big Book of Dinosaurs (DK Big Books)","Hardcover – Illustrated, October 6, 2015","Angela Wilkes","Angela Wilkes is the author of several Dorling Kindersley books, including The Children's Step-by-Step Cookbook and My First Word Book.","DK Children","Illustrated edition (October 6, 2015",2015,"Hardcover",32,"English","9781465443779","978-1465443779","Children's Books","Science, Nature & How It Works",4.8,2153,11.29,"Full of detailed artwork and photographs of lifelike models, | The Big Book of Dinosaurs | is an enticing collection of amazing prehistoric creatures that will entertain children for hours. | This visual guide features simple but informative text and interactive questions that encourage young children to make their own dinosaur discoveries. From the fierce, meat-eating Tyrannosaurus and the long-necked, plant-eating Diplodocus to the armor-plated Stegosaurus and the tiny, hen-sized Compsognathus, this book is packed with fun facts. | The Big Book of Dinosaurs | is the ultimate first dinosaur book for young readers and will gets kids excited about learning and the prehistoric world.","11 x 0.39 x 14.25 inches","1.47 pounds",666.8
"85","As I Lay Dying: The Corrected Text","Paperback – January 30, 1991","William Faulkner","Born in 1897 in New Albany, Mississippi, William Faulkner was the son of a family proud of their prominent role in the history of the south. He grew up in Oxford, Mississippi, and left high school at fifteen to work in his grandfather's bank. Rejected by the US military in 1915, he joined the Canadian flyers with the RAF, but was still in training when the war ended. Returning home, he studied at the University of Mississippi and visited Europe briefly in 1925. His first poem was published in The New Republic in 1919. His first book of verse and early novels followed, but his major work began with the publication of The Sound and the Fury in 1929. As I Lay Dying (1930), Sanctuary (1931), Light in August (1932), Absalom, Absalom! (1936) and The Wild Palms (1939) are the key works of his great creative period leading up to Intruder in the Dust (1948). During the 1930s, he worked in Hollywood on film scripts, notably The Blue Lamp, co-written with Raymond Chandler. William Faulkner was awarded the Nobel Prize for Literature in 1949 and the Pulitzer Prize for The Reivers just before his death in July 1962. Photo by Carl Van Vechten [Public domain], via Wikimedia Commons.","Vintage","Reissue edition (January 30, 1991",1991,"Paperback",267,"English","067973225X","978-0679732259","Politics & Social Sciences","Politics & Government",4.4,2389,10.89,"A true 20th-century classic from the Nobel Prize-winning author of | The Sound and the Fury | : the famed harrowing account of the Bundren family’s odyssey across the Mississippi countryside to bury Addie, their wife and mother. | As I Lay Dying | is one of the most influential novels in American fiction in structure, style, and drama. Narrated in turn by each of the family members, including Addie herself as well as others, the novel ranges in mood from dark comedy to the deepest pathos. “I set out deliberately to write a tour-de-force. Before I ever put pen to paper and set down the first word I knew what the last word would be and almost where the last period would fall.” —William Faulkner on | As I Lay Dying | This edition reproduces the corrected text of | As I Lay Dying | as established in 1985 by Noel Polk.","5.16 x 0.63 x 7.95 inches","7.6 ounces",215.5
"86","The Sleepy Little Alphabet: A Bedtime Story from Alphabet Town","Hardcover – Picture Book, June 9, 2009","Judy Sierra","Judy Sierra is the author of the New York Times #1 bestseller Wild About Books and its sequels ZooZical, Wild About You, and Everyone Counts, all illustrated by Marc Brown. Her expertise at creating funny stories told in read-aloud rhyme that trips off the tongue has won her high praise and honors. Dr. Sierra's carefully curated anthologies of folktales have been awarded the Aesop Prize by the American Folklore Society, and are included in elementary school textbooks worldwide. Visit her at www.judysierra.net","Knopf Books for Young Readers","Illustrated edition (June 9, 2009",2009,"Hardcover",40,"English","0375840028","978-0375840029","Children's Books","Growing Up & Facts of Life",4.8,303,17.99,"An exceptional bedtime read-aloud for 2-6 year olds! | It's sleepy time in Alphabet Town. The moms and dads (capital letters) run around and around as they struggle to corral their children (little letters) into bed. Judy Sierra's lively, giggly couplets mingle with hilarious collages by Melissa Sweet.At every turn of the page, little letters grow sleeper and sleepier, from wide-awake | a | to sound-asleep baby | z. | The book will enchant for many evenings, offering up new surprises as readers discover secrets and clues in the A to Z illustrations of this exceptional bedtime read-aloud.","8.38 x 0.32 x 10.44 inches","11.8 ounces",334.5
"87","Mushoku Tensei: Jobless Reincarnation (Light Novel) Vol. 8","Paperback – December 22, 2020","理不尽な孫の手","Discover more of the author’s books, see similar authors, read author blogs and more","Airship","Illustrated edition (December 22, 2020",2020,"Paperback",320,"English","1645057933","978-1645057932","Science Fiction & Fantasy","Fantasy",4.7,1749,12.59,"BACK TO SCHOOL | A letter for Rudeus arrives out of the blue, bearing an invitation to enroll at the Ranoa University of Magic. The admissions exam is a cakewalk, but once Rudeus is accepted, a far less straightforward challenge awaits him—getting to know his eccentric new classmates!","5 x 0.83 x 7.1 inches","8.2 ounces",232.5
"88","Crimson Lake: A Novel (Crimson Lake, 1)","Paperback – January 14, 2020","Candice Fox","Discover more of the author’s books, see similar authors, read author blogs and more","Forge Books","Media tie-in edition (January 14, 2020",2020,"Paperback",352,"English","1250624398","978-1250624390","Mystery, Thriller & Suspense","Thrillers & Suspense",4.3,1577,9.99,"Candice Fox's thrilling | Crimson Lake | , the basis for the series Troppo starring Thomas Jane, now streaming on Freevee! | How do you move on when the world won’t let you? | 12:46: Claire Bingley stands alone at a bus stop12:47: Ted Conkaffey parks his car beside her12:52: The girl is missing . . .Six minutes in the wrong place at the wrong time―that’s all it took to ruin Sydney detective Ted Conkaffey’s life. Accused but not convicted of a brutal abduction, Ted is now a free man―and public enemy number one. Maintaining his innocence, he flees north to keep a low profile amidst the steamy, croc-infested wetlands of Crimson Lake.There, Ted’s lawyer introduces him to eccentric private investigator Amanda Pharrell, herself a convicted murderer. Not entirely convinced Amanda is a cold-blooded killer, Ted agrees to help with her investigation, a case full of deception and obsession, while secretly digging into her troubled past. The residents of Crimson Lake are watching the pair's every move . . . and the town offers no place to hide. | ""Complex, human characters, and a dark, meaty story, and fine writing, and a great sense of place – this is one of the best crime thrillers of the year. Sign me up as a big-time Fox fan!"" ―Lee Child | Crimson Lake | by Sydney-based, Ned Kelly award-winning author Candice Fox is a thrilling contemporary crime novel set in Queensland, Australia, perfect for readers of authors like James Patterson, Harlan Coben, Lisa Gardner, and Tana French.","6.14 x 0.97 x 9.32 inches","12.8 ounces",362.9
"89","Fairy Dance, Vol. 3 (Sword Art Online)","Paperback – Illustrated, December 16, 2014","Reki Kawahara","Reki Kawahara (川原 礫 Kawahara Reki, born August 17, 1974) is the Japanese author of the light novels and manga Sword Art Online and Accel World. Both series have been adapted into anime. He has also written The Isolator (絶対ナル孤独者 Zettainaru Aisorēta), a light novel series which began publishing in print in June 2014, after having been serialised online starting in 2004, and the manga and light novels for the spinoff series Sword Art Online: Progressive. The Sword Art Online series was first published online in 2002, under the pen name Fumio Kunori (九里史生 ). Kawahara entered the first Accel World novel into ASCII Media Works' 15th Dengeki Novel Prize in 2008 and the novel won the Grand Prize. The first novel was published by ASCII Media Works on February 10, 2009 under their Dengeki Bunko imprint. As of October 10, 2015, 19 volumes have been published. After gaining fame from the Dengeki award, Kawahara republished Sword Art Online in print. 16 volumes have been published as of August 2015, as well as four volumes of Sword Art Online: Progressive. Bio from Wikipedia, the free encyclopedia.","Yen On","Illustrated edition (December 16, 2014",2014,"Paperback",208,"English","0316296422","978-0316296427","Science Fiction & Fantasy","Science Fiction",4.7,908,13,"Kirito has escaped Sword Art Online, the forbidden VRMMORPG of death, and returned to reality. He heads off to find his game partner and lover, Asuna Yuuki. But Asuna never made it back from the nightmare. Lost and desperate, Kirito's only clue to her virtual whereabouts is a mysterious screenshot of Asuna as a fairy trapped in a giant birdcage. His conclusion: She must be trapped within the new, high-powered VRMMORPG, ALfheim Online. Now Kirito must plunge into the world of ALO, where players are fairies who fly gracefully through the air!","5.5 x 0.5 x 8.25 inches","6.9 ounces",195.6
"90","Modern Classics My Autobiography","","Charles Chaplin","Discover more of the author’s books, see similar authors, read author blogs and more","Penguin Classic","New Ed edition (February 25, 2003",2003,"Paperback",576,"English","0141011475","978-0141011479","Biographies & Memoirs","Arts & Literature",4.5,1448,21.62,"A silent comedy star whose legendary slapstick routines are recognisable to this day, Charles 'Charlie' Chaplin's My Autobiography is an incomparably vivid account of the life of one of the greatest filmmakers and comedians, with an introduction by David Robinson As a child, Charlie Chaplin was awed and inspired by the sight of glamorous vaudeville stars passing his home, and from then on he never lost his ambition to become an actor. Chaplin's film career as the Little Tramp adored by the whole world is the stuff of legend, but this frank autobiography shows another side. Born into a theatrical family, Chaplin's father died of drink while his mother, unable to bear the poverty, suffered from bouts of insanity. From a childhood of grinding poverty in the south London slums, Chaplin found an escape in his early debut on the music hall stage, followed by his lucky break in America, the founding of United Artists with D.W. Griffith and Douglas Fairbanks, the struggle to maintain artistic control over his work, the string of failed marriages, and his eventual exile from Hollywood after personal scandals and persecution for his left-wing politics during the McCarthy Era. Sir Charles 'Charlie' Chaplin (1895-1976) was born in Walworth, London. Best known for his work in silent film, his most famous role was The Little Tramp, a universally recognisable and iconic character who appeared in films such as The Kid (1921), The Gold Rush (1925) and City Lights (1931). His other films include Modern Times (1936), a commentary on the Great Depression, and The Great Dictator (1940), a satirical attack on Hitler and the Nazis. If you enjoyed My Autobiography, you might like Andy Warhol's The Philosophy of Andy Warhol, also available in Penguin Modern Classics. 'Tells so much about this curious, difficult man ... a wonderfully vivid imagination' The New York Times 'The only genius to come out of the movie industry' George Bernard Shaw","8.66 x 5.91 x 0.98 inches","13.2 ounces",374.2
"91","Las Ratitas 2. Súper Alma en acción","Hardcover – July 7, 2020","Las Ratitas","Discover more of the author’s books, see similar authors, read author blogs and more","Destino Infantil & Juvenil","July 7, 2020",2020,"Hardcover",144,"Spanish","8408227971","978-8408227977","Children's Books","",4.7,1215,25.87,"¡Las Ratitas se van de vacaciones! Sus padres las llevan a un hotel dedicado a los animales, donde organizan un espectacular desfile de mascotas. Gisele y Claudia, muy emocionadas, inscriben a su perra Alma en el desfile. El problema es que un precioso gatito ha desaparecido del hotel... ¿Necesitarán la ayuda de Las Súper Ratitas? ¿Podrá Súper Alma echarles una pata? ¡Descúbrelo en esta divertida y misteriosa aventura!","5.91 x 0.59 x 8.46 inches","12.3 ounces",348.7
"92","Firstlife (An Everlife Novel)","Hardcover – February 23, 2016","Gena Showalter","Gena Showalter is the New York Times and USA TODAY bestselling author of multiple ""unputdownable"" series in paranormal, contemporary, and young adult romance. Learn more about Gena, her menagerie of rescue dogs, and all her upcoming books at genashowalter.com","Harlequin Teen","Original edition (February 23, 2016",2016,"Hardcover",480,"English","0373211570","978-0373211579","Teen & Young Adult","Literature & Fiction",4.4,1287,9.97,"""Utterly unique and absolutely riveting—I couldn't put it down! What a marvelously cool world.""— | New York Times | bestselling author Sarah J. MaasFrom the author of the | New York Times | bestselling White Rabbit Chronicles series comes book 1 of a brand new series in which life as we know it is merely a dress rehearsal, and real life begins after death. | Tenley ""Ten"" Lockwood is an average seventeen-year-old girl…who has spent the past thirteen months locked inside the Prynne Asylum. The reason? Not her obsession with numbers, but her refusal to let her parents choose where she'll live—after she dies. | There is an eternal truth most of the world has come to accept: Firstlife is merely a dress rehearsal, and real life begins after death. | In the Everlife, two realms are in power: Troika and Myriad, longtime enemies and deadly rivals. Both will do anything to recruit Ten, including sending their top Laborers to lure her to their side. Soon, Ten finds herself on the run, caught in a wild tug-of-war between the two realms who will do anything to win the right to her soul. Who can she trust? And what if the realm she's drawn to isn't where the boy she's falling for lives? She just has to stay alive long enough to make a decision…","5.83 x 1.51 x 8.43 inches","1.15 pounds",521.6
"93","The Big Six","Paperback – International Edition, November 3, 2014","Arthur Ransome","Arthur Ransome was born in Leeds in 1884 and went to school at Rugby. He was in Russia in 1917, and witnessed the Revolution, which he reported for the Manchester Guardian. After escaping to Scandinavia, he settled in the Lake District with his Russian wife where, in 1929, he wrote Swallows and Amazons. And so began a writing career which has produced some of the real children's treasures of all time. In 1936 he won the first ever Carnegie Medal for his book, Pigeon Post. Ransome died in 1967. He and his wife Evgenia lie buried in the churchyard of St Paul's Church, Rusland, in the southern Lake District. Photography (c) Arthur Ransome's Literary Executors & courtesy of the Brotherton Collection, Leeds University Library","Vintage Classics","November 3, 2014",2014,"Paperback",448,"English","9780099589358","978-0099589358","Children's Books","Classics",4.6,270,9.33,"Plunge into the Norfolk Broads as the Ds join up with the Coot Club once again, this time to solve a very baffling crime. | 'Why shouldn't we be detectives too?' | When Dick and Dorothea arrive in the Norfolk Broads all set for a blissful summer on the river, they find their friends the Death and Glories in a very bad situation. Accused of setting boats adrift, sabotage and theft, the boys are under suspicion by everyone on the river. And in the meantime, the real culprits are still at large. There's no choice but to form a crime-busting team: The Big Six. As the evidence stacks against them, can they solve the mystery and trap the real criminals?","5.14 x 1.37 x 7.42 inches","14.4 ounces",408.2
"94","Here's the Deal: A Memoir","Audio CD – Unabridged, May 24, 2022","Kellyanne Conway","Discover more of the author’s books, see similar authors, read author blogs and more","Simon & Schuster Audio","Unabridged edition (May 24, 2022",2022,"",NA,"English","1797134574","978-1797134574","Politics & Social Sciences","Politics & Government",4.7,2661,36.26,"Among the Trump era’s savviest insiders, one name stands especially tall: Kellyanne. | As a highly respected pollster for corporate and Republican clients and a frequent television talk show guest, Kellyanne Conway had already established herself as one of the brightest lights on the national political scene when Donald Trump asked her to run his presidential campaign. She agreed, delivering him to the White House, becoming the first woman in American history to manage a winning presidential campaign, and changing the American landscape forever. Who she is, how she did it, and who tried to stop her is a fascinating story of personal triumph and political intrigue that has never been told…until now. In | Here’s The Deal, | Kellyanne takes you on a journey all the way to the White House and beyond with her trademark sharp wit, raw honesty, and level eye. It’s all here: what it’s like to be dissected on national television. How to outsmart the media mob. How to outclass the crazy critics. How to survive and succeed male-dominated industries. What happens when the perils of social media really hit home. And what happens when the divisions across the country start playing out in one’s own family. In this open and vulnerable account, Kellyanne turns the camera on herself. What she has to share—about our politics, about the media, about her time in the White House, and about her personal journey—is an astonishing glimpse of visibility and vulnerability, of professional and personal highs and lows, and ultimately, of triumph.","5.06 x 1.5 x 5.88 inches","3.2 ounces",90.7
